A1: Tillbaka

A1: Noter med redovisningsprinciper och bokslutskommentarer
G2: ='RR & BR'!H3 -> 38352 | H2: ='RR & BR'!J3 -> 37986
A3: Allmänna redovisningsprinciper
A4: Årsredovisningen har upprättats enligt årsredovisningslagen och bokföringsnämndens allmänna råd.
A5: En äkta bostadsrättsförening beskattas enligt schablon som ett privatbostadsföretag vilket innebär att det ej finns någon skillnad mellan redovisade och skattemässiga värden på tillgångar och skulder. Uppskjutna skattefordringar i underskottsavdrag redovisas endast i den mån det är sannolikt att beloppen kan utnyttjas mot framtida skattepliktiga överskott.
A7: Underskottsavdrag enligt senaste inlämnad deklaration till skattemyndigheten var 33 134 341 kr.
A9: Belopp i kr om inget annat anges.
A11: Underhåll/underhållsfond
A12: Enligt anvisning från Bokföringsnämnden redovisas underhållsfonden som en del av bundet eget kapital. Avsättning enligt plan och ianspråktagande för genomförda åtgärder sker genom överföring mellan fritt och bundet eget kapital efter beslut av styrelsen. Avsättning utöver plan sker genom disposition på föreningsstämma.
A14: Årets underhållskostnader redovisas i resultaträkningen inom årets resultat. För att öka informationen och förtydliga föreningens långsiktiga underhållsplanering anges planenlig fondavsättning och ianspråktaganden ur fonden som tillägg till resultaträkningen.
A16: Byte av redovisningsprincip
A17: Införandet av den nya anvisningen, BFNAR 2003:4, avseende redovisning av underhållsfonden har inneburit ett byte av redovisningsprincip varvid även jämförelseårets siffror omarbetats. Underhållsfonden har tidigare redovisats som avsättning men skall enligt anvisningen redovisas under eget kapital.
A19: Värderingsprinciper m m
A20: Tillgångar och skulder har värderats till anskaffningsvärden om inget annat anges nedan. Fordringar Fordringar har efter individuell värdering upptagits till belopp varmed de beräknas inflyta. Avskrivningsprinciper för anläggningstillgångar Avskrivningar enligt plan baseras på ursprungliga anskaffningsvärden och beräknad nyttjandeperiod. Nedskrivning sker vid bestående värdenedgång.
A22: Följande avskrivningstider tillämpas:
A24: Immateriella anläggningstillgångar
A25: Bostadslånepost | G25: X år
A26: Materiella anläggningstillgångar
A27: Byggnader, enligt progressiv plan | G27: 85
A28: Standardförbättringar och markanläggningar | G28: 10
A29: Bostadslånepost | G29: X år
A30: Inventarier, fastighetsinventarier | G30: 5
A32: Not 1 | B32: Årsavgifter och hyror
A33: Årsavgifter, bostäder | G33: =-7667695.75+220.38 -> -7667475.3700000001 | H33: -11594683.98
A34: Årsavgifter, lokaler | G34: 0 | H34: 0
A35: Årsavgifter, övriga | G35: 0 | H35: 0
A36: Avgår: avsatt till medl. reparationsfond | G36: 0 | H36: 0
A37: Hyror, bostäder | G37: 0 | H37: 0
A38: Hyror, lokaler | G38: 0 | H38: 0
A39: Hyror, lokaler | G39: -7110 | H39: -11320
A40: Hyror, garage | G40: -172600 | H40: -257400
A41: Hyror, p-platser | G41: =-46980+180 -> -46800 | H41: -70200
A42: Hyror, övriga | G42: 0 | H42: 0
G43: =SUM(K46:K55) -> -7893985.3700000001 | H43: =SUM(L46:L55) -> -11933603.98
A44: Löptider på lokalhyreskontrakt
A45: Löptid till år | D45: Antal kontrakt | G45: Hyra i kronor | H45: Andel i %
A46: 2000 | D46: – | G46: –
A47: 2001 | D47: – | G47: –
A48: 2002 | D48: – | G48: –
A50: Not 2 | B50: Hyres- och avgiftsbortfall
A51: Hyres- och avgiftsbortfall, bostäder | G51: 0 | H51: 0
A52: Hyres- och avgiftsbortfall, lokaler | G52: 0 | H52: 0
A53: Hyres- och avgiftsbortfall, garage | G53: 0 | H53: 1540
A54: Hyres- och avgiftsbortfall, p-platser | G54: =1080-180 -> 900 | H54: 2160
A55: Hyres- och avgiftsbortfall, övrigt | G55: 0 | H55: 0
A56: Rabatter | G56: 0 | H56: 0
G57: =SUM(K64:K69) -> 900 | H57: =SUM(L64:L69) -> 3700
B59: Övriga avgifter
A60: Bränsleavgifter, övrigt | G60: -231333.95 | H60: -1194690.6
A61: Bränsleavgifter, bostäder | G61: -751989.06 | H61: 0
A62: Bränsleavgifter, övrigt | G62: 0 | H62: 0
A63: Vattenavgifter | G63: 0 | H63: 0
A64: Vattenavgifter | G64: 0 | H64: 0
A65: Elavgifter | G65: 0 | H65: 0
G66: =SUM(K73:K78) -> -983323.01 | H66: =SUM(L73:L78) -> -1194690.6
A68: Not 3 | B68: Övriga förvaltningsintäkter
A69: Kabel-tv-avgifter | G69: 0 | H69: 0
A70: Kabel-tv-avgifter | G70: 0 | H70: 0
A71: IT-avgifter | G71: 0 | H71: 0
A72: Erhållna räntebidrag | G72: 0 | H72: 0
A73: Övriga lokalintäkter | G73: 0 | H73: 0
A74: Övriga avgifter | G74: 0 | H74: 0
A75: IT-avgifter | G75: 0 | H75: 0
A76: Balkonginglasning | G76: 0 | H76: 0
A77: Övriga ersättningar | G77: 0 | H77: 0
A78: Övriga ersättningar | G78: -167 | H78: -5603
A79: Fakturerade kostnader | G79: 0 | H79: 0
A80: Fakturerade kostnader | G80: 0 | H80: -524.02
A81: Lagsökning | G81: 0 | H81: 0
A82: Övriga sidointäkter | G82: 0 | H82: 0
A83: Värmeförsäljning | G83: 0 | H83: 0
A84: Rörelsens sidointäkter & korrigeringar | G84: 75.24 | H84: =-167.89-4 -> -171.89
A85: Övriga intäkter | G85: 0 | H85: 0
A86: Återvunna fordringar | G86: 0 | H86: 0
A87: Vinst vid avyttring av anläggningstillgångar | G87: 0 | H87: 0
A88: Övriga intäkter/återbetalningar | G88: =-89358.1+462 -> -88896.1 | H88: -27100
A89: Övriga rörelseintäkter | G89: 0 | H89: 0
G90: =SUM(K82:K102) -> -88987.86 | H90: =SUM(L82:L102) -> -33398.91
A92: Not 4 | B92: Reparationer, löpande underhåll
A93: Material gemensamma utrymmen | G93: 0 | H93: 0
A94: Material markytor | G94: 0 | H94: 0
A95: Bostäder | G95: 205729 | H95: 136972.5
A96: Vattenskador | G96: 0 | H96: 0
A97: Bostäder | G97: 0 | H97: 0
A98: Lokaler, gemensamma utrymmen | G98: 0 | H98: 0
A99: Lokaler, gemensamma utrymmen | G99: 0 | H99: 0
A100: VVS | G100: 0 | H100: 0
A101: Ventilation | G101: 0 | H101: 0
A102: Elinstallationer | G102: 0 | H102: 0
A103: Hissar | G103: 0 | H103: 0
A104: Huskropp | G104: 0 | H104: 0
A105: Gårdar och grönanläggningar | G105: 0 | H105: 0
A106: Garage och parkeringsplatser | G106: 0 | H106: 0
A107: Tvättstugor | G107: 0 | H107: 0
A108: Tele/TV/Porttelefon | G108: 0 | H108: 0
A109: Övriga installationer | G109: 0 | H109: 0
A110: Övriga reparationer | G110: 0 | H110: 0
A111: Vandalisering | G111: 0 | H111: 0
A112: Övriga reparationer | G112: 0 | H112: 0
A113: Självrisk | G113: 0 | H113: 0
G114: =SUM(K106:K126) -> 205729 | H114: =SUM(L106:L126) -> 136972.5
A116: Not 5 | B116: Underhåll
A117: Material mark och gemensamma utrymmen | G117: 0 | H117: 0
A118: Bostäder | G118: 0 | H118: 629938
A119: Lokaler, gemensamma utrymmen | G119: 0 | H119: 0
A120: Lokaler, gemensamma utrymmen | G120: 0 | H120: 0
A121: VVS | G121: 0 | H121: 0
A122: Ventilation | G122: 0 | H122: 0
A123: Elinstallationer | G123: 0 | H123: 0
A124: Tele/TV/Porttelefon | G124: 0 | H124: 0
A125: Hissar | G125: 0 | H125: 0
A126: Övriga installationer | G126: 0 | H126: 0
A127: Huskroppar | G127: 0 | H127: 0
A128: Gårdar och grönanläggningar | G128: 0 | H128: 0
A129: Garage och parkeringsplatser | G129: 0 | H129: 0
A130: Tvättstugor | G130: 0 | H130: 0
A131: Övrigt underhåll | G131: 0 | H131: 0
G132: =SUM(K130:K144) -> 0 | H132: =SUM(L130:L144) -> 629938
B134: Fastighetsskatt
A135: Fastighetsskatt | G135: 339000 | H135: 524280
G136: =SUM(K148) -> 339000 | H136: =SUM(L148) -> 524280
A138: Not 4 | B138: Driftskostnader
A139: Övrigt | G139: 0 | H139: 0
A140: Tomträttsavgäld (löptid tom år XXXX) | G140: 0 | H140: 0
A141: Vägavgifter, arrende | G141: 0 | H141: 0
A142: Fastighetsförsäkring | G142: 0 | H142: 0
A143: Fastighetsförsäkring | G143: 44980 | H143: 124845.5
A144: Arvode förvaltning | G144: 0 | H144: 0
A145: Arvode förvaltning | G145: 0 | H145: 0
A146: Arvode förvaltning | G146: 201860 | H146: 278583
A147: Kabel-TV | G147: =53088+17698 -> 70786 | H147: 104112
A148: IT-kostnader | G148: 0 | H148: 0
A149: Juridiska kostnader | G149: 675 | H149: 612.5
A150: Övriga riskkostnader | G150: 0 | H150: 0
A151: Arvode auktoriserad revisor | G151: 14000 | H151: 10000
A152: Möteskostnader | G152: 0 | H152: 0
A153: Övriga förvaltningskostnader | G153: 0 | H153: 0
A154: Fastighetsskötsel | G154: 240672 | H154: 337825
A155: Trädgårdsskötsel | G155: 0 | H155: 0
A156: Städ | G156: 0 | H156: 0
A157: Sotning | G157: 0 | H157: 0
A158: Obligatoriska besiktningar | G158: 0 | H158: 0
A159: Bevakningskostnader | G159: 0 | H159: 0
A160: Övriga utgifter, köpta tjänster | G160: 0 | H160: 0
A161: Snöröjning | G161: 24403 | H161: 40672
A162: Materiel, skötsel och städ | G162: 0 | H162: 0
A163: Ersättningar till hyresgäster | G163: 0 | H163: 0
A164: Drift och förbrukning, övrigt | G164: 0 | H164: 0
A165: Förbrukningsmateriel | G165: 35407.55 | H165: 91196.3
A166: Fordons- och maskinkostnader | G166: 0 | H166: 0
A167: Fordons- och maskinkostnader | G167: 0 | H167: 0
A168: Frakter och transporter | G168: 0 | H168: 0
A169: Vatten | G169: 255032 | H169: 401581
A170: El | G170: 56462 | H170: 83184
A171: Uppvärmning | G171: 0 | H171: 0
A172: Uppvärmning | G172: 1077841 | H172: 1337809
A173: Sophantering | G173: 195097 | H173: 250416
A174: Övrigt | G174: 0 | H174: 0
G175: =SUM(K152:K187) -> 2217215.55 | H175: =SUM(L152:L187) -> 3060836.3
A177: Not 5 | B177: Övriga kostnader
A178: Fritidsmedel | G178: 0 | H178: 0
A179: Lokalkostnader | G179: 0 | H179: 0
A180: Resekostnader | G180: 0 | H180: 0
A181: Övriga administrativa kostnader | G181: 13402.65 | H181: 42394.42
A182: Övriga försäljningskostnader | G182: 0 | H182: 0
A183: Övriga försäljningskostnader | G183: 0 | H183: 0
A184: Kreditupplysningar | G184: 0 | H184: 0
A185: Representation | G185: 0 | H185: 0
A186: Kontorsmateriel | G186: 0 | H186: 0
A187: Telefon och porto | G187: 3593 | H187: 7446
A188: Hyresförluster | G188: 0 | H188: 0
A189: Konstaterade förluster hyror/avgifter | G189: 0 | H189: 0
A190: Befarade förluster hyror/avgifter | G190: 0 | H190: 0
A191: Konstaterade förluster kundfordringar | G191: 0 | H191: 0
A192: Befarade förluster kundfordringar | G192: 0 | H192: 0
A193: Tidskrifter och facklitteratur | G193: 0 | H193: 0
A194: Medlems- och föreningsavgifter | G194: 3870 | H194: 5224
A195: Serviceavgifter | G195: 0 | H195: 0
A196: Köpta tjänster | G196: 70695 | H196: 47831
A197: Konsultarvoden | G197: 0 | H197: 0
A198: Bankkostnader | G198: 0 | H198: 0
A199: Advokat och rättegångskostnader | G199: 0 | H199: 0
A200: Övriga externa kostnader | G200: 0 | H200: 0
A201: Övriga externa kostnader | G201: 0 | H201: 0
A202: Övriga externa kostnader | G202: 0 | H202: 0
G203: =SUM(K191:K215) -> 91560.65 | H203: =SUM(L191:L215) -> 102895.42
A205: Klass 9 | G205: 0 | H205: 0
A207: Not 6 | B207: Personalkostnader
A208: Medelantalet anställda | G208: 0 | H208: 0
A209: Varav män | G209: 0 | H209: 0
A211: Löner, andra ersättningar och sociala kostnader
A212: Styrelsearvode | G212: 75150 | H212: 67
A213: Övriga ersättningar till förtroendevalda | G213: 0 | H213: 0
A214: Övriga ersättningar till förtroendevalda | G214: 4848.6 | H214: 29100.400000000001
A215: Uttagsskatt förtroendevalda | G215: 0 | H215: 0
A216: Övriga kostnadsersättningar | G216: 189 | H216: 0
A217: Övriga arvoden | G217: 400 | H217: 20700
A218: Föreningsvald revisor | G218: 1999 | H218: 1500
A219: Lön till fastighetsskötare | G219: 0 | H219: 0
A220: Lön till fastighetsskötare | G220: 0 | H220: 0
A221: Övriga ersättningar | G221: 2650 | H221: 6200
A222: Personalomkostnader fastighetsskötare | G222: 0 | H222: 0
A223: Personalomkostnader fastighetsskötare | G223: 0 | H223: 0
A224: Uttagsskatt fastighetsskötare | G224: 0 | H224: 0
A225: Övriga kostnadsersättningar | G225: 0 | H225: 0
A226: Lön till städpersonal | G226: 0 | H226: 0
A227: Lön till städpersonal | G227: 0 | H227: 0
A228: Lön till städpersonal | G228: 0 | H228: 0
A229: Personalomkostnader städpersonal | G229: 0 | H229: 0
A230: Personalomkostnader städpersonal | G230: 0 | H230: 0
A231: Uttagsskatt städpersonal | G231: 0 | H231: 0
A232: Övriga kostnadsersättningar | G232: 0 | H232: 0
A233: Lön till övrig personal | G233: 0 | H233: 0
A234: Lön till övrig personal | G234: 0 | H234: 0
A235: Personalomkostnader övrig personal | G235: 0 | H235: 0
A236: Utbildning | G236: 0 | H236: 0
A237: Personalomkostnader övrig personal | G237: 0 | H237: 0
A238: Uttagsskatt övrig personal | G238: 0 | H238: 0
A239: Övriga kostnadsersättningar | G239: 0 | H239: 0
A240: Pensionskostnader | G240: 0 | H240: 0
A241: Pensionskostnader | G241: 0 | H241: 0
A242: Pensionskostnader | G242: 0 | H242: 0
A243: Pensionskostnader | G243: 0 | H243: 0
A244: Utbildning, förtroendevalda | G244: 3600 | H244: 0
A245: Övriga personalkostnader | G245: 0 | H245: 0
A246: Summa | G246: =SUM(K225:K258) -> 88836.6 | H246: =SUM(L225:L258) -> 125150.39999999999
A247: Sociala kostnader | G247: 26281.17 | H247: 52906.93
A248: (varav pensionskostnader) | G248: 0 | H248: 0
A249: (varav pensionskostnader) | G249: 0 | H249: 0
G250: =SUM(K259:K260) -> 115117.77 | H250: =SUM(L259:L260) -> 178057.33
A252: Styrelsen har haft X möten under året.
A254: Not 7 | B254: Avskrivningar av anläggningstillgångar
A255: Immateriella anläggningstillgångar | G255: 0 | H255: 0
A256: Bostadslånepost | G256: 0 | H256: 0
A257: Underhållslånepost | G257: 0 | H257: 0
A258: Reparationslånepost | G258: 0 | H258: 0
A259: Underhållslånepost | G259: 0 | H259: 0
A260: Ersättningslånepost | G260: 0 | H260: 0
A261: Byggnader, byggn.inventarier, markanl. | G261: 462486 | H261: 483273.75
A262: Avskrivning om- och tillbyggnader | G262: =126462.5-3000 -> 123462.5 | H262: 0
A263: Byggnadsinventarier | G263: 0 | H263: 0
A264: Markanläggningar | G264: 0 | H264: 0
A265: Markinventarier | G265: 0 | H265: 0
A266: Anslutningsavgifter | G266: 0 | H266: 0
A267: Standardförbättringar | G267: 0 | H267: 0
A268: Markinventarier | G268: 0 | H268: 0
A269: Maskiner och inventarier | G269: 21800.7 | H269: =35358.85 -> 35358.85
A270: Installationer | G270: 0 | H270: 0
G271: =SUM(K268:K283) -> 607749.2 | H271: =SUM(L268:L283) -> 518632.6
B273: Jämförelsestörande poster
A274: Intäkter av engångskaraktär | G274: 0 | H274: 0
A275: Kostnader av engångskaraktär | G275: 0 | H275: 0
A276: Förlust vid avyttring av anl. tillgång | G276: 0 | H276: 0
A277: Övriga rörelsekostnader | G277: 0 | H277: 0
G278: =SUM(K287:K290) -> 0 | H278: =SUM(L287:L290) -> 0
B280: Resultat från finansiella anl. tillg.
A281: Utdelning andelar | G281: 0 | H281: 0
A282: Utdelning andelar | G282: -100000 | H282: -107740
A283: Resultat vid förs. av aktier och andelar | G283: 0 | H283: 0
A284: Resultat vid förs. av aktier och andelar | G284: 0 | H284: 0
A285: Ränteintäkter | G285: 0 | H285: 0
A286: Ränteintäkter | G286: 0 | H286: 0
A287: Upp/nedskrivning av värdepapper | G287: 0 | H287: 0
A288: Återföring av nedskrivna värdepapper | G288: 0 | H288: 0
G289: =SUM(K294:K301) -> -100000 | H289: =SUM(L294:L301) -> -107740
A291: Not 8 | B291: Ränteintäkter
A292: Ränteintäkter bank | G292: 0 | H292: 0
A293: Ränteintäkter avräkning med Föreningssparbanken | G293: -4216.94 | H293: -16432.4
A294: Ränteintäkter spec. utlån till Riksbyggen | G294: -54443 | H294: -109063.25
A295: Avgifts- och hyresfordringar | G295: -37.41 | H295: -1488.52
A296: Övriga ränteintäkter | G296: -38667 | H296: 0
A297: Övriga finansiella intäkter | G297: 0 | H297: 0
G298: =SUM(K305:K310) -> -97364.35 | H298: =SUM(L305:L310) -> -126984.17
B301: Statliga bostadsbyggnadssubventioner
A302: Räntebidrag | G302: 0 | H302: 0
A303: Övrigt | G303: 0 | H303: 0
G304: =SUM(K315:K316) -> 0 | H304: =SUM(L315:L316) -> 0
A306: Not 9 | B306: Räntekostnader
A307: Räntekostnader, fastighetslån | G307: 4884530 | H307: 7518813
A308: Övriga räntekostnader | G308: 0 | H308: 287.59
A309: Övriga finansiella kostnader | G309: 0 | H309: 0
A310: Övriga finansiella kostnader | G310: =-28300+57000 -> 28700 | H310: 3900
G311: =SUM(K320:K323) -> 4913230 | H311: =SUM(L320:L323) -> 7523000.5899999999
B313: Jämförelsestörande finansiella poster
A314: Extraord.intäkter och kostnader | G314: 0 | H314: 0
A315: Ränteskillnadsersättning | G315: 0 | H315: 0
A316: Nedskrivning av låneskuld | G316: 0 | H316: 0
A317: Nedskrivning av fastigheten | G317: 0 | H317: 0
G318: =SUM(K327:K330) -> 0 | H318: =SUM(L327:L330) -> 0
B320: Bokslutsdispositioner
A321: Förändring av periodiseringsfond | G321: 0 | H321: 0
A322: Överavskrivningar | G322: 0 | H322: 0
A323: Förändring av ersättningsfond | G323: 0 | H323: 0
A324: Förändring av allmän investeringsreserv | G324: 0 | H324: 0
A325: Förändring av allmän investeringsreserv | G325: 0 | H325: 0
A326: Övriga bokslutsdispositioner | G326: -141423 | H326: 0
G327: =SUM(K334:K339) -> -141423 | H327: =SUM(L334:L339) -> 0
B329: Inkomstskatt
A330: Inkomstskatt | G330: 0 | H330: 0
G331: =SUM(K343) -> 0 | H331: =SUM(L343) -> 0
B333: Immateriella anläggningstillgångar
A334: Hyresrätt | G334: 0 | H334: 0
A335: Avskr.immateriella anl. tillgångar | G335: 0 | H335: 0
G336: =SUM(K347:K348) -> 0 | H336: =SUM(L347:L348) -> 0
B338: Bostadslånepost
A339: Vid årets början | G339: =SUM(K353:K354) -> 0 | H339: =SUM(L353:L354) -> 0
A340: Förändring av bostadslånepost | G340: 0 | H340: 0
A341: Vid årets slut | G341: 0 | H341: 0
B343: Övriga Låneposter
A344: Underhållslånepost | G344: 0 | H344: 0
A345: Underhållslånepost | G345: 0 | H345: 0
A346: Reparationslånepost | G346: 0 | H346: 0
A347: Ersättingslånepost | G347: 0 | H347: 0
A348: Övriga särskilda fodringar | G348: 0 | H348: 0
G349: =SUM(K357:K361) -> 0 | H349: =SUM(L357:L361) -> 0
A351: Standardförbättringar | G351: 1108162.5 | H351: 1234625
A352: Markanläggningar | G352: 0 | H352: 0
A353: Markanläggningar | G353: 0 | H353: 0
A354: Markinventarier | G354: 0 | H354: 0
A355: Markinventarier | G355: 0 | H355: 0
A356: Anslutningsavgifter | G356: 0 | H356: 0
A357: Anslutningsavgifter | G357: 0 | H357: 0
A358: Standardförbättringar | G358: -308656.25 | H358: -308656.25
A360: Not 10 | B360: Byggnader och mark
A361: Anskaffningsvärden
A362: Vid årets början
A363: Byggnader | G363: 101482190 | H363: 101482190
A364: Byggnadsinventarier | G364: 0 | H364: 0
A365: Mark | G365: 0 | H365: 0
A366: Tomtmark | G366: 6377800 | H366: 6377800
A367: Standardförbättringar | G367: 0 | H367: 0
A368: Anslutningsavgifter | G368: =L369 -> 0 | H368: =M369 -> 0
A369: Standardförbättringar | G369: =L364 -> 1234625 | H369: =M364 -> 1234625
A370: Markanläggning | G370: =L365 -> 0 | H370: =M365 -> 0
A371: Markinventarier | G371: =L367 -> 0 | H371: =M367 -> 0
G372: =SUM(K376:K384) -> 109094615 | H372: =SUM(L376:L384) -> 109094615
A373: Årets anskaffningar
A374: Byggnader | G374: 0 | H374: 0
A375: Mark | G375: 0 | H375: 0
A376: Tomtmark | G376: 0 | H376: 0
A377: Anslutningsavgifter | G377: =K369-L369 -> 0 | H377: =L369-M369 -> 0
A378: Standardförbättringar | G378: 0 | H378: =L364-M364 -> 0
A379: Markanläggning | G379: =K365-L365 -> 0 | H379: =L365-M365 -> 0
A380: Markinventarier | G380: =K367-L367 -> 0 | H380: =L367-M367 -> 0
G381: =SUM(K387:K393) -> 0 | H381: =SUM(L387:L393) -> 0
A383: Avyttringar och utrangeringar byggnader | G383: 0 | H383: 0
A384: Avyttringar och utrangeringar mark | G384: 0 | H384: 0
A385: Summa anskaffningsvärden | G385: =K385+K394+K396+K397 -> 109094615 | H385: =L385+L394+L396+L397 -> 109094615
A387: Ackumulerade avskrivningar enligt plan
A388: Vid årets början
A389: Byggnader | G389: -10595938.76 | H389: -10297858.76
A390: Mark | G390: 0 | H390: 0
A391: Anslutningsavgifter | G391: =K370+K279 -> 0 | H391: =L370+L279 -> 0
A392: Standardförbättringar | G392: =K371-K275+K276+K280-K415 -> -308656.25 | H392: =L371+L275+L276+L280 -> -308656.25
A393: Markanläggningar | G393: =K366+K277 -> 0 | H393: =L366+L277 -> 0
A394: Markinventarier | G394: =K368+K278+K281 -> 0 | H394: =L368+L278+L281 -> 0
G395: =SUM(K402:K407) -> -10904595.01 | H395: =SUM(L402:L407) -> -10606515.01
A397: Avyttringar och utrangeringar | G397: 0 | H397: 0
A398: Årets avskrivning enligt plan byggnader | G398: -462486 | H398: -298080
A399: Årets avskrivning enligt plan | G399: 0 | H399: 0
A400: Årets avskrivning enligt plan markanläggning | G400: 0 | H400: 0
A401: Årets avskrivning anslutningsavgifter | G401: =-K279 -> 0 | H401: =-L279 -> 0
A402: Årets avskrivning standardförbättringar | G402: =-K275-K276-K280 -> -123462.5 | H402: =-L275-L276-L280 -> 0
A403: Årets avskrivning markanläggningar | G403: =-K277 -> 0 | H403: =-L277 -> 0
A404: Årets avskrivning markinventarier | G404: =-K278-K281 -> 0 | H404: =-L278-L281 -> 0
A405: Summa ack. avskr. enligt plan | G405: =K408+SUM(K410:K417) -> -11490543.51 | H405: =L408+SUM(L410:L417) -> -10904595.01
A407: Ackumulerade upp- och nedskrivningar
A408: Vid årets början | G408: 0 | H408: 0
A409: Vid årets början | G409: 0 | H409: 0
A410: Avyttringar och utrangeringar | G410: 0 | H410: 0
A411: Avyttringar och utrangeringar | G411: 0 | H411: 0
A412: Under året återförda nedskr. | G412: 0 | H412: 0
A413: Under året återförda nedskr. | G413: 0 | H413: 0
A414: Under året återförda nedskr. | G414: 0 | H414: 0
A415: Årets nedskrivningar | G415: 0 | H415: 0
A416: Summa ack. upp- och nedskrivningar | G416: =SUM(K421:K428) -> 0 | H416: =SUM(L421:L428) -> 0
A418: Restvärde enligt plan vid årets slut | G418: =K398+K418+K429 -> 97604071.489999995 | H418: =L398+L418+L429 -> 98190019.989999995
A419: Varav
A420: Byggnader | G420: =K376+K377+K387+K396+K402+SUM(K410:K412)+K429 -> 90423765.239999995 | H420: =L376+L377+L387+L396+L402+SUM(L410:L412)+L429 -> 90886251.239999995
A421: Mark | G421: =K378+K379+K388+K389+K403+K397 -> 6377800 | H421: =L378+L379+L388+L397+L403+L389 -> 6377800
A422: Anslutningsavgifter | G422: =K381+K390+K404+K414 -> 0 | H422: =L379+L380+L389+L398+L404+L390 -> 115472415
A423: Standardförbättringar | G423: =K380+K382+K391+K405+K415 -> 802506.25 | H423: 925969
A424: Markanläggningar | G424: =K383+K406+K413+K416 -> 0 | H424: =L381+L382+L391+L400+L406+L392 -> 1234625
A425: Markinventarier | G425: =K384+K393+K407+K417 -> 0 | H425: =L382+L383+L392+L401+L407+L393 -> 1234625
A429: Taxeringsvärden, byggnader | G429: 45000000 | H429: 57120000
A430: varav lokaler | G430: 0 | H430: 0
A431: Taxeringsvärden, mark | G431: 22800000 | H431: 12784000
A432: Totalt taxeringsvärde | G432: =K442+K444 -> 67800000 | H432: =L442+L444 -> 69904000
A434: 1) Aktiverad ränta ingår med X kr [gäller enbart framtida belopp].
A437: Not 11 | B437: Maskiner, inventarier, fastighetsinventarier
A438: Anskaffningsvärden
A439: Vid årets början
A440: Maskiner och inventarier
A441: Maskiner | G441: 0 | H441: 0
A442: Inventarier och verktyg | G442: =28475+215353 -> 243828 | H442: =28475+215353 -> 243828
A443: Installationer | G443: 23000 | H443: 23000
A444: Bilar och andra transportmedel | G444: 0 | H444: 0
A445: Bilar och andra transportmedel | G445: 0 | H445: 0
A446: Bilar och andra transportmedel | G446: 0 | H446: 0
G447: =SUM(K453:K459) -> 266828 | H447: =SUM(L453:L459) -> 266828
A448: Årets anskaffningar
A449: Maskiner och inventarier | G449: 0 | H449: 0
A450: Maskiner | G450: 0 | H450: 0
A451: Inventarier och verktyg | G451: 0 | H451: 0
A452: Installationer | G452: 0 | H452: 0
A453: Bilar och andra transportmedel | G453: 0 | H453: 0
G454: =SUM(K462:K466) -> 0 | H454: =SUM(L462:L466) -> 0
A456: Avyttringar och utrangeringar
A457: Maskiner och inventarier | G457: 0 | H457: 0
A458: Maskiner | G458: 0 | H458: 0
A459: Inventarier och verktyg | G459: 0 | H459: 0
A460: Installationer | G460: 0 | H460: 0
A461: Bilar och andra transportmedel | G461: 0 | H461: 0
G462: =SUM(K470:K474) -> 0 | H462: =SUM(L470:L474) -> 0
A463: Summa anskaffningsvärden | G463: =K460+K467+K475 -> 266828 | H463: =L460+L467+L475 -> 266828
A465: Ackumulerade avskrivningar enligt plan
A466: Vid årets början
A467: Maskiner och inventarier | G467: =K494+K487 -> 0 | H467: =L494+L487 -> 0
A468: Maskiner | G468: =K488+K495 -> 0 | H468: =L488+L495 -> 0
A469: Inventarier och verktyg | G469: =K489+K496 -> -195241.45 | H469: =L489+L496 -> -159882.6
A470: Installationer | G470: =K490+K497 -> -23000 | H470: =L490+L497 -> -23000
A471: Bilar och andra transportmedel | G471: =K491+K498 -> 0 | H471: =L491+L498 -> 0
G472: =SUM(K480:K484) -> -218241.45 | H472: =SUM(L480:L484) -> -182882.6
A473: Årets avskrivningar
A474: Maskiner och inventarier | G474: 0 | H474: 0
A475: Maskiner | G475: 0 | H475: 0
A476: Inventarier och verktyg | G476: 21800.7 | H476: 35358.85
A477: Installationer | G477: 0 | H477: 0
A478: Bilar och andra transportmedel | G478: 0 | H478: 0
G479: =SUM(K487:K491) -> 21800.7 | H479: =SUM(L487:L491) -> 35358.85
A480: Ackumulerade avskrivningar
A481: Maskiner och inventarier | G481: 0 | H481: 0
A482: Maskiner | G482: 0 | H482: 0
A483: Inventarier och verktyg | G483: -217042.15 | H483: -195241.45
A484: Installationer | G484: -23000 | H484: -23000
A485: Bilar och andra transportmedel | G485: 0 | H485: 0
A487: Summa ack. avskr. enligt plan | G487: =SUM(K494:K499) -> -240042.15 | H487: =SUM(L494:L499) -> -218241.45
A489: Planenligt restvärde vid årets slut | G489: =K476+K500 -> 26785.85 | H489: =L476+L500 -> 48586.55
A490: Varav
A491: Maskiner | G491: =K453+K454+K462+K463+K494+K495 -> 0 | H491: =L453+L454+L462+L463+L494+L495 -> 0
A492: Inventarier och verktyg | G492: =K455+K464+K496 -> 26785.85 | H492: =L455+L464+L496 -> 48586.55
A493: Installationer | G493: =K456+K497 -> 0 | H493: =L456+L497 -> 0
A494: Bilar och andra transportmedel | G494: =K457+K458+K459+K466+K498 -> 0 | H494: =L457+L458+L459+L466+L498 -> 0
B497: Pågående byggnation och förskott
A498: Pågående byggnation och förskott | G498: 0 | H498: 0
A499: Pågående byggnation och förskott | G499: 0 | H499: 0
G500: =SUM(K511:K512) -> 0 | H500: =SUM(L511:L512) -> 0
B502: Bostadsrätter
A503: Andelar i bostadsrättsföreningar | G503: 0 | H503: 0
G504: =SUM(K516) -> 0 | H504: =SUM(L516) -> 0
A506: Föreningen äger X lgh som hyrs ut, vilka redovisas som anläggningstillgångar.
A507: Föreningen hade vid bokslutstillfället X tomma lägenheter i sin ägo. Dessa skall försöka
A508: säljas snarast möjligt och redovisas under omsättningstillgångar.
A510: Not 12 | B510: Långfristiga värdepappersinnehav
A512: Lån till Bostadsrättsföreningarnas Intresseförening för X andelar i Riksbyggen | G512: 0 | H512: 0
A513: Obligationer, värdepapper [spec] | G513: 0 | H513: 0
A514: Obligationer, värdepapper [spec] | G514: 0 | H514: 0
A515: Obligationer, värdepapper | G515: =800000-500000 -> 300000 | H515: 300000
G516: =SUM(K525:K528) -> 300000 | H516: =SUM(L525:L528) -> 300000
A518: Not 13 | B518: Långfristiga fordringar
A519: Långfristiga fordringar | G519: 0 | H519: 0
A520: Långfristiga fordringar | G520: 0 | H520: 0
A521: Långfristiga fordringar | G521: 0 | H521: 0
A522: Andelar i Riksbyggen | G522: =1000000+500000 -> 1500000 | H522: 1000000
G523: =SUM(K532:K535) -> 1500000 | H523: =SUM(L532:L535) -> 1000000
B525: Bränslelager
A526: Bränslelager | G526: 0 | H526: 0
G527: =SUM(K539:K539) -> 0 | H527: =SUM(L539:L539) -> 0
B529: Avgifts- och hyresfordringar
A530: Avgifts- och hyresfordringar | G530: -622890 | H530: -335008
G531: =SUM(K543:K543) -> -622890 | H531: =SUM(L543:L543) -> -335008
B533: Kundfordringar
A534: Kundfordringar | G534: 0 | H534: 0
A535: Kundfordringar | G535: 0 | H535: 0
G536: =SUM(K547:K548) -> 0 | H536: =SUM(L547:L548) -> 0
B538: Skattefordringar
A539: Avräkning skatter och avgifter | G539: 0 | H539: 0
A540: Skattefordringar | G540: 0 | H540: 0
A541: Skattefordringar | G541: 0 | H541: 0
A542: Skattekonto | G542: 38667 | H542: 0
G543: =SUM(K552:K555) -> 38667 | H543: =SUM(L552:L555) -> 0
B545: Övriga fordringar
A546: Fordringar hos anställda | G546: 0 | H546: 0
A547: Momsfordringar | G547: 0 | H547: 0
A548: Andra kortfristiga fordringar | G548: 0 | H548: 0
A549: Andra kortfristiga fordringar | G549: 0 | H549: 0
A550: Värderegleringar kortfr. Fordringar | G550: 0 | H550: 0
G551: =SUM(K559:K563) -> 0 | H551: =SUM(L559:L563) -> 0
A553: Not 14 | B553: Förutbetalda kostn. och upplupna intäkter
A554: Förutbetalda driftkostnader | G554: 0 | H554: 0
A555: Förutbetalt förvaltningsarvode | G555: 0 | H555: 0
A556: Förutbetald elavgift | G556: 0 | H556: 0
A557: Förutbetald vattenavgift | G557: 0 | H557: 0
A558: Förutbetald uppvärmning | G558: 0 | H558: 0
A559: Förutbetald renhållning | G559: 0 | H559: 0
A560: Förutbetald kabel-tv-avgift | G560: 17696 | H560: 17698
A561: Förutbetald kostnad bredbandsanslutning | G561: 0 | H561: 0
A562: Övriga förutbetalda driftkostnader | G562: 0 | H562: 0
A563: Övriga förutbetalda kostnader | G563: 584 | H563: 0
A564: Upplupna räntebidrag | G564: 0 | H564: 0
A565: Upplupna ROT-bidrag | G565: 0 | H565: 0
A566: Förutbetald AMF | G566: 0 | H566: 0
A567: Förutbetald samfällighetsavgift | G567: 0 | H567: 0
A568: Upplupna ränteintäkter | G568: 9321 | H568: 4740
A569: Fastighetsförsäkring | G569: 0 | H569: 0
A570: Fastighetsskatt | G570: 418836 | H570: 266893
A571: Övrigt | G571: 0 | H571: 0
A572: Övrigt | G572: 0 | H572: 0
A573: Övrigt | G573: 0 | H573: 0
G574: =SUM(K567:K586) -> 446437 | H574: =SUM(L567:L586) -> 289331
A576: Not 15 | B576: Specialutlåning till Riksbyggen
A577: Specialutlåning till Riksbyggen | G577: 3750000 | H577: 2600000
B579: Lån nummer | D579: Typ | E579: Saldo | F579: Ränta | G579: Slutdatum
B580: 20100850151 | D580: 30 dagar | E580: 750000 | F580: 1.2 | G580: 38362
B581: 20300850129 | D581: 90 dagar | E581: 1000000 | F581: 2.1 | G581: 38362
B582: 20300850130 | D582: 90 dagar | E582: 1000000 | F582: 2.05 | G582: 38393
B583: 20300850131 | D583: 90 dagar | E583: 1000000 | F583: 2 | G583: 38421
B586: Värdepapper
A587: Värdepapper | G587: 0 | H587: 0
A588: Specialutlåning | G588: 0 | H588: 0
A589: Värdepapper | G589: 0 | H589: 0
G590: =SUM(K600:K602) -> 0 | H590: =SUM(L600:L602) -> 0
A592: Not 16 | B592: Kassa och bank
A593: Handkassa | G593: 3000 | H593: 3000
A594: Bankmedel | G594: 0 | H594: 0
A595: Bankmedel | G595: 0 | H595: 0
A596: Bankcertifikat | G596: 0 | H596: 0
A597: Bankmedel | G597: 0 | H597: 0
A598: Avräkning med Föreningssparbanken | G598: 733268.74 | H598: 973381.3
A599: Avräkning med Riksbyggen | G599: 0 | H599: 0
A600: Bankmedel | G600: 0 | H600: 0
G601: =SUM(K606:K613) -> 736268.74 | H601: =SUM(L606:L613) -> 976381.3
B603: Eget kapital SPEC
A604: Insatser | G604: 0 | H604: 0
A605: Insatser | G605: 0 | H605: 0
A606: Insatser | G606: -5509995 | H606: -5509995
G607: =SUM(K617:K619) -> -5509995 | H607: =SUM(L617:L619) -> -5509995
A608: Eget kapital | G608: 0 | H608: 0
A609: Föreningens reparationsfond/ yttre fond | G609: -1775589.15 | H609: 0
A610: Årets avsättning till föreningens repfond/ yttre fond | G610: -900000 | H610: 0
A611: Disponerat ur föreningens repfond/ yttre fond | G611: 0 | H611: 0
A612: Upplåtelseavgifter | G612: -267565 | H612: -267565
A613: Kapitaltillskott | G613: 0 | H613: 0
A614: Egna bostadsrätter | G614: 0 | H614: 0
A615: Reservfond | G615: 0 | H615: 0
A616: Uppskrivningsfond | G616: 0 | H616: 0
A617: Dispositionsfond | G617: 0 | H617: 0
A618: Balanserat resultat | G618: -3445271.76 | H618: -3447228.84
A619: Årets resultat | G619: -869043.42 | H619: -898042.92
A620: Årets resultat | G620: 869043.42 | H620: 898042.92
A621: Avsättning till reparationsfonder | G621: 0 | H621: -2405527.15
A623: Not 17 | B623: Eget kapital | E623: Bundet | F623: Bundet | G623: Fritt | H623: Fritt
E624: Insatser och uppl. avgift | F624: Underhålls- fond | G624: Disp.fond | H624: Resultat
A625: Vid årets början | E625: =L620+L625+L626+L627+L628+L629 -> -5777560 | F625: =K622 -> -1775589.15 | G625: =L630 -> 0 | H625: =-1*L631-L632 -> 4345271.76
A626: Disposition enl stämmobeslut | G626: 0
A627: Förändring av underhållsfond | H627: ='RR & BR'!H46 -> -900000
A628: Avsättning enligt plan | F628: =K623 -> -900000
A629: Ianspråkstagande ur fond | F629: =K624 -> 0
A630: Årets resultat | H630: =-'RR & BR'!H40 -> 814581.42
A631: Vid årets slut | E631: =SUM(I638:I643) -> -5777560 | F631: =SUM(J638:J643) -> -2675589.15 | G631: =SUM(K638:K643) -> 0 | H631: =SUM(L638:L643) -> 4259853.18
B634: Obeskattade reserver
A635: Ackumulerad överavskrivning | G635: 0 | H635: 0
A636: Övriga reserver | G636: 0 | H636: 0
A637: Övriga reserver | G637: 0 | H637: 0
A638: Summa obeskattade reserver | G638: =SUM(K648:K650) -> 0 | H638: =SUM(L648:L650) -> 0
B640: Övriga avsättningar
A641: Övriga avsättningar | G641: 0 | H641: 0
G642: =SUM(K654:K654) -> 0 | H642: =SUM(L654:L654) -> 0
A644: Not 18 | B644: Fastighetslån, långfristiga
A645: Fastighetslån | G645: =K659+K660 -> -90111670 | H645: =L659+L660 -> -90331058
A646: Avgår nästa års amortering | G646: 0 | H646: 0
A647: Skuld vid årets slut | G647: -90111670 | H647: -90331058
A649: Låneinstitut | C649: Ränta | D649: Bundet till | E649: Ing. skuld | F649: Nya lån | G649: Årets amort. | H649: Utg. skuld
A650: SBAB | C650: 5.5 | D650: 2002-09-18 | E650: 0 | F650: 0 | G650: 0 | H650: 0
A651: SBAB | C651: 5.5 | D651: 2002-09-18 | E651: 0 | F651: 0 | G651: 0 | H651: 0
A652: SBAB | C652: 5.5 | D652: 2002-09-18 | E652: 0 | F652: 0 | G652: 0 | H652: 0
A653: SBAB | C653: 5.5 | D653: 2002-09-18 | E653: 0 | F653: 0 | G653: 0 | H653: 0
A654: SBAB | C654: 5.75 | D654: 2005-08-22 | E654: 0 | F654: 0 | G654: 0 | H654: 0
A655: SBAB | C655: 5.9 | D655: 2008-03-03 | E655: 0 | F655: 0 | G655: 0 | H655: 0
A656: STATENS BOSTADS AB | C656: 4.29 | D656: 2006-06-15 | E656: 9178349.2699999996 | F656: 0 | G656: 22643 | H656: 9155706.2699999996
A657: STATENS BOSTADS AB | C657: 4.29 | D657: 2006-06-15 | E657: 1428865.99 | F657: 0 | G657: 3564 | H657: 1425301.99
A658: STATENS BOSTADS AB | C658: 4.29 | D658: 2006-06-15 | E658: 12386064.99 | F658: 0 | G658: 30538 | H658: 12355526.99
A659: STATENS BOSTADS AB | C659: 4.29 | D659: 2006-06-15 | E659: 1252096.99 | F659: 0 | G659: 3140 | H659: 1248956.99
A660: STATENS BOSTADS AB | C660: 5.75 | D660: 2005-08-22 | E660: 33105877 | F660: 0 | G660: 81532 | H660: 33024345
A661: STATENS BOSTADS AB | C661: 5.9 | D661: 2008-03-03 | E661: 32979807 | F661: 0 | G661: 77971 | H661: 32901836
E662: =SUM(I663:I674) -> 90331061.239999995 | F662: =SUM(J663:J674) -> 0 | G662: =SUM(K663:K674) -> 219388 | H662: =SUM(L663:L674) -> 90111673.239999995
A663: Pågående projekt | G663: 0 | H663: 0
A664: Färdigställda projekt | G664: 0 | H664: 0
G665: =SUM(K676:K677) -> 0 | H665: =SUM(L676:L677) -> 0
A666: Beviljad limit: XXXXX kr
B668: Övriga skulder, långfristiga
A669: Övriga skulder | G669: 0 | H669: 0
A670: Övriga skulder | G670: 0 | H670: 0
G671: =SUM(K682:K683) -> 0 | H671: =SUM(L682:L683) -> 0
B674: Fastighetslån, kortfristiga
A675: Fastighetslån, kortfr. del av långfr. skuld | G675: =K659 -> 0 | H675: =L659 -> 0
G676: =SUM(K688:K688) -> 0 | H676: =SUM(L688:L688) -> 0
B678: Leverantörsskulder
A679: Leverantörsskulder | G679: -379727.25 | H679: -293194.5
G680: =SUM(K692:K692) -> -379727.25 | H680: =SUM(L692:L692) -> -293194.5
B682: Moms- och skatteskulder
A683: Skatteskulder | G683: 0 | H683: 0
A684: Skatteskuld, moms | G684: 0 | H684: 0
A685: Skatteskulder | G685: 0 | H685: 0
G686: =SUM(K696:K698) -> 0 | H686: =SUM(L696:L698) -> 0
B688: Medlemmarnas reparationsfond
A689: Medlemmarnas reparationsfond | G689: 0 | H689: 0
G690: =SUM(K702:K702) -> 0 | H690: =SUM(L702:L702) -> 0
A692: Not 19 | B692: Övriga skulder, kortfristiga
A693: Kortfristiga låneskulder | G693: 0 | H693: 0
A694: Övriga skulder till kunder | G694: -5575 | H694: -5575
A695: Övriga skulder till kreditinstitut | G695: 0 | H695: 0
A696: Upplupna sociala avg. och skatter | G696: -231 | H696: -56620.93
A697: Avräkning vattenavgifter | G697: 0 | H697: 0
A698: Avräkning HUS | G698: 0 | H698: 0
A699: Avräkning LÅN | G699: 0 | H699: 0
A700: Avräkning LÖN | G700: 0 | H700: 0
A701: Övrigt | G701: 0 | H701: 0
A702: Skulder till anställda | G702: 0 | H702: 0
A703: Löneskulder | G703: 0 | H703: 0
A704: Skulder till anställda | G704: 0 | H704: 0
A705: Övriga kortfristiga låneskulder | G705: 0 | H705: 0
G706: =SUM(K706:K718) -> -5806 | H706: =SUM(L706:L718) -> -62195.93
A708: Not 20 | B708: Upplupna kostn. och förutbetalda intäkter
A709: Upplupna löner och sociala avgifter | G709: -14295 | H709: -16020
A710: Upplupna räntekostnader | G710: -481404 | H710: -403217
A711: Förutbetalda hyror och avgifter | G711: 0 | H711: 0
A712: Upplupna drift- och underhållskostnader | G712: 0 | H712: 0
A713: Upplupen kostnad för rep och underhåll | G713: 0 | H713: 0
A714: Upplupna elkostnader | G714: 0 | H714: 0
A715: Upplupna vattenavgifter | G715: 0 | H715: 0
A716: Upplupna värmekostnader | G716: 0 | H716: 0
A717: Upplupen kostnad renhållning | G717: -11785 | H717: -10354
A718: Upplupen kostnad kabel-TV | G718: 0 | H718: 0
A719: Övriga upplupna kostnader för drift och underhåll | G719: 0 | H719: 0
A720: Övrigt | G720: -61650 | H720: -54850
G721: =SUM(K722:K733) -> -569134 | H721: =SUM(L722:L733) -> -484441
A725: Lund / -2005
A730: =Förvaltningsberättelse!A5 -> Joakim Simonsson | G730: =Förvaltningsberättelse!A6 -> Jeanette Bengtsson
A736: =Förvaltningsberättelse!A7 -> Sten Welander | G736: =Förvaltningsberättelse!A8 -> Johan Smeds
A742: =Förvaltningsberättelse!A9 -> Ronny Hellgren | G742: =Förvaltningsberättelse!A10 -> Enn Kaldjärv
A748: =Förvaltningsberättelse!A11 -> Martin Böök
A751: Vår revisionsberättelse har avgivits
A753: Malmö / -2005 | G753: Lund / -2005
A758: Ann Theander | G758: =Förvaltningsberättelse!A21 -> Kenneth Hansen
A770: Auktoriserad revisor
A771: Lindebergs Grant Thornton AB